{
  "$schema": "https://json-schema.org/draft/2020-12/schema",
  "title": "coverage",
  "description": "本机完整覆盖表。A → B、C。outbox coverage.json。只能以 coverage_share 形式离开老师电脑。§5",
  "type": "object",
  "additionalProperties": false,
  "required": ["lesson_id", "teacher_id", "class_id", "syllabus_id", "syllabus_version", "generated_at", "points"],
  "properties": {
    "lesson_id": {"type": "string", "pattern": "^L-[A-Za-z0-9]+-\\d{8}-\\d{4}$"},
    "teacher_id": {"type": "string", "minLength": 1},
    "class_id": {"type": "string", "minLength": 1},
    "syllabus_id": {"type": "string", "minLength": 1},
    "syllabus_version": {"type": "integer", "minimum": 1},
    "generated_at": {"type": "string", "pattern": "^\\d{4}-\\d{2}-\\d{2}T\\d{2}:\\d{2}:\\d{2}(\\.\\d+)?[+-]\\d{2}:\\d{2}$"},
    "points": {
      "type": "array",
      "items": {
        "type": "object",
        "additionalProperties": false,
        "required": ["kp_id", "covered", "minutes", "segment_ids"],
        "properties": {
          "kp_id": {"type": "string", "minLength": 1},
          "covered": {"type": "boolean"},
          "minutes": {"type": "number", "minimum": 0},
          "segment_ids": {"type": "array", "items": {"type": "string", "pattern": "^S-L-[A-Za-z0-9]+-\\d{8}-\\d{4}-\\d{3}$"}}
        }
      }
    }
  }
}
